{
  "artifactPhase": "SPECIFICATION_FIXTURE_ONLY",
  "canonicalPayload": {
    "availableModes": [
      "count",
      "share"
    ],
    "categoryId": "fixture-category",
    "count": {
      "comparisonState": "unavailable",
      "deviationRaw": null,
      "deviationUnit": "brands",
      "focusValue": null,
      "peerMedian": null,
      "peerValues": []
    },
    "defaultMode": "count",
    "focusExcludedFromMedian": true,
    "focusObjectId": "focus",
    "payloadId": "category-benchmark:F172_S001_positive_sub_precision",
    "payloadVersion": "2.0.0",
    "peerObjectIds": [
      "peer-1"
    ],
    "provenance": {
      "ownerDecisionCommentId": 5085245278,
      "rawInputSha256": "93c6d898d78303a7c9d1b07f18a185c0cebb3d01dd42b98b0b17b1e7d42ce32e",
      "sourceFixtureId": "F172_S001_positive_sub_precision"
    },
    "quality": {
      "limitations": [],
      "state": "ok"
    },
    "share": {
      "comparisonState": "above",
      "deviationRaw": 0.004999999999999449,
      "deviationUnit": "percentage_points",
      "focusShareExact": 0.10005,
      "peerMedianShareExact": 0.1,
      "peerSharesExact": [
        0.1
      ],
      "shareExactDelta": 4.999999999999449e-05
    },
    "state": "ok"
  },
  "caseKey": "share_positive_sub_precision",
  "expectedExportProjection": {
    "fixtureId": "F172_S001_positive_sub_precision",
    "payloadVersion": "2.0.0",
    "projection": {
      "accessibleRelationText": "Фокусный объект выше медианы менее чем на 0,1 процентного пункта.",
      "boundaryApplied": true,
      "comparisonState": "above",
      "consumerCalculations": [],
      "cssState": "above",
      "deviationRaw": 0.004999999999999449,
      "displayDeviation": null,
      "displayRelationText": "выше медианы менее чем на 0,1 п.п.",
      "displayUnit": "percentage_points",
      "glyph": "▲",
      "mode": "share"
    },
    "surface": "CategoryBenchmarkExportManifest/PDF-sidecar"
  },
  "expectedProjection": {
    "accessibleRelationText": "Фокусный объект выше медианы менее чем на 0,1 процентного пункта.",
    "boundaryApplied": true,
    "comparisonState": "above",
    "consumerCalculations": [],
    "cssState": "above",
    "deviationRaw": 0.004999999999999449,
    "displayDeviation": null,
    "displayRelationText": "выше медианы менее чем на 0,1 п.п.",
    "displayUnit": "percentage_points",
    "glyph": "▲",
    "mode": "share"
  },
  "expectedSurfaces": {
    "accessibility": {
      "applicable": true,
      "consumerCalculations": [],
      "projection": {
        "accessibleRelationText": "Фокусный объект выше медианы менее чем на 0,1 процентного пункта.",
        "boundaryApplied": true,
        "comparisonState": "above",
        "consumerCalculations": [],
        "cssState": "above",
        "deviationRaw": 0.004999999999999449,
        "displayDeviation": null,
        "displayRelationText": "выше медианы менее чем на 0,1 п.п.",
        "displayUnit": "percentage_points",
        "glyph": "▲",
        "mode": "share"
      }
    },
    "css": {
      "applicable": true,
      "consumerCalculations": [],
      "projection": {
        "accessibleRelationText": "Фокусный объект выше медианы менее чем на 0,1 процентного пункта.",
        "boundaryApplied": true,
        "comparisonState": "above",
        "consumerCalculations": [],
        "cssState": "above",
        "deviationRaw": 0.004999999999999449,
        "displayDeviation": null,
        "displayRelationText": "выше медианы менее чем на 0,1 п.п.",
        "displayUnit": "percentage_points",
        "glyph": "▲",
        "mode": "share"
      }
    },
    "csv": {
      "applicable": false,
      "consumerCalculations": [],
      "projection": null,
      "reason": "NO_DEDICATED_CATEGORY_BENCHMARK_EXPORT_SURFACE_ON_BASELINE"
    },
    "desktop": {
      "applicable": true,
      "consumerCalculations": [],
      "projection": {
        "accessibleRelationText": "Фокусный объект выше медианы менее чем на 0,1 процентного пункта.",
        "boundaryApplied": true,
        "comparisonState": "above",
        "consumerCalculations": [],
        "cssState": "above",
        "deviationRaw": 0.004999999999999449,
        "displayDeviation": null,
        "displayRelationText": "выше медианы менее чем на 0,1 п.п.",
        "displayUnit": "percentage_points",
        "glyph": "▲",
        "mode": "share"
      }
    },
    "mobile": {
      "applicable": true,
      "consumerCalculations": [],
      "projection": {
        "accessibleRelationText": "Фокусный объект выше медианы менее чем на 0,1 процентного пункта.",
        "boundaryApplied": true,
        "comparisonState": "above",
        "consumerCalculations": [],
        "cssState": "above",
        "deviationRaw": 0.004999999999999449,
        "displayDeviation": null,
        "displayRelationText": "выше медианы менее чем на 0,1 п.п.",
        "displayUnit": "percentage_points",
        "glyph": "▲",
        "mode": "share"
      }
    },
    "pdf": {
      "applicable": true,
      "consumerCalculations": [],
      "projection": {
        "accessibleRelationText": "Фокусный объект выше медианы менее чем на 0,1 процентного пункта.",
        "boundaryApplied": true,
        "comparisonState": "above",
        "consumerCalculations": [],
        "cssState": "above",
        "deviationRaw": 0.004999999999999449,
        "displayDeviation": null,
        "displayRelationText": "выше медианы менее чем на 0,1 п.п.",
        "displayUnit": "percentage_points",
        "glyph": "▲",
        "mode": "share"
      }
    },
    "xlsx": {
      "applicable": false,
      "consumerCalculations": [],
      "projection": null,
      "reason": "NO_DEDICATED_CATEGORY_BENCHMARK_EXPORT_SURFACE_ON_BASELINE"
    }
  },
  "fixtureId": "F172_S001_positive_sub_precision",
  "implementationEvidenceAvailable": false,
  "kind": "positive",
  "mode": "share",
  "productionConformanceClaimed": false,
  "rawInput": {
    "focusShareExact": 0.10005,
    "mode": "share",
    "peerMedianShareExact": 0.1,
    "signedZeroSource": false,
    "sourceDeviationRaw": 0.004999999999999449
  },
  "sourceIssue": "#172"
}
