{
  "artifactPhase": "SPECIFICATION_FIXTURE_ONLY",
  "canonicalPayload": {
    "availableModes": [
      "count",
      "share"
    ],
    "categoryId": "fixture-category",
    "count": {
      "comparisonState": "equal",
      "deviationRaw": 0.0,
      "deviationUnit": "brands",
      "focusValue": 10,
      "peerMedian": 10,
      "peerValues": [
        10
      ]
    },
    "defaultMode": "count",
    "focusExcludedFromMedian": true,
    "focusObjectId": "focus",
    "payloadId": "category-benchmark:F172_C005_exact_zero",
    "payloadVersion": "2.0.0",
    "peerObjectIds": [
      "peer-1"
    ],
    "provenance": {
      "ownerDecisionCommentId": 5085245278,
      "rawInputSha256": "2523944715e1d2a8a71a6ab83f5433ad38e6d7e6114987208cf4787b0191823d",
      "sourceFixtureId": "F172_C005_exact_zero"
    },
    "quality": {
      "limitations": [],
      "state": "ok"
    },
    "share": {
      "comparisonState": "unavailable",
      "deviationRaw": null,
      "deviationUnit": "percentage_points",
      "focusShareExact": null,
      "peerMedianShareExact": null,
      "peerSharesExact": [],
      "shareExactDelta": null
    },
    "state": "ok"
  },
  "caseKey": "count_exact_zero",
  "expectedExportProjection": {
    "fixtureId": "F172_C005_exact_zero",
    "payloadVersion": "2.0.0",
    "projection": {
      "accessibleRelationText": "Фокусный объект на уровне медианы.",
      "boundaryApplied": false,
      "comparisonState": "equal",
      "consumerCalculations": [],
      "cssState": "equal",
      "deviationRaw": 0.0,
      "displayDeviation": 0,
      "displayRelationText": "на уровне медианы",
      "displayUnit": "brands",
      "glyph": "●",
      "mode": "count"
    },
    "surface": "CategoryBenchmarkExportManifest/PDF-sidecar"
  },
  "expectedProjection": {
    "accessibleRelationText": "Фокусный объект на уровне медианы.",
    "boundaryApplied": false,
    "comparisonState": "equal",
    "consumerCalculations": [],
    "cssState": "equal",
    "deviationRaw": 0.0,
    "displayDeviation": 0,
    "displayRelationText": "на уровне медианы",
    "displayUnit": "brands",
    "glyph": "●",
    "mode": "count"
  },
  "expectedSurfaces": {
    "accessibility": {
      "applicable": true,
      "consumerCalculations": [],
      "projection": {
        "accessibleRelationText": "Фокусный объект на уровне медианы.",
        "boundaryApplied": false,
        "comparisonState": "equal",
        "consumerCalculations": [],
        "cssState": "equal",
        "deviationRaw": 0.0,
        "displayDeviation": 0,
        "displayRelationText": "на уровне медианы",
        "displayUnit": "brands",
        "glyph": "●",
        "mode": "count"
      }
    },
    "css": {
      "applicable": true,
      "consumerCalculations": [],
      "projection": {
        "accessibleRelationText": "Фокусный объект на уровне медианы.",
        "boundaryApplied": false,
        "comparisonState": "equal",
        "consumerCalculations": [],
        "cssState": "equal",
        "deviationRaw": 0.0,
        "displayDeviation": 0,
        "displayRelationText": "на уровне медианы",
        "displayUnit": "brands",
        "glyph": "●",
        "mode": "count"
      }
    },
    "csv": {
      "applicable": false,
      "consumerCalculations": [],
      "projection": null,
      "reason": "NO_DEDICATED_CATEGORY_BENCHMARK_EXPORT_SURFACE_ON_BASELINE"
    },
    "desktop": {
      "applicable": true,
      "consumerCalculations": [],
      "projection": {
        "accessibleRelationText": "Фокусный объект на уровне медианы.",
        "boundaryApplied": false,
        "comparisonState": "equal",
        "consumerCalculations": [],
        "cssState": "equal",
        "deviationRaw": 0.0,
        "displayDeviation": 0,
        "displayRelationText": "на уровне медианы",
        "displayUnit": "brands",
        "glyph": "●",
        "mode": "count"
      }
    },
    "mobile": {
      "applicable": true,
      "consumerCalculations": [],
      "projection": {
        "accessibleRelationText": "Фокусный объект на уровне медианы.",
        "boundaryApplied": false,
        "comparisonState": "equal",
        "consumerCalculations": [],
        "cssState": "equal",
        "deviationRaw": 0.0,
        "displayDeviation": 0,
        "displayRelationText": "на уровне медианы",
        "displayUnit": "brands",
        "glyph": "●",
        "mode": "count"
      }
    },
    "pdf": {
      "applicable": true,
      "consumerCalculations": [],
      "projection": {
        "accessibleRelationText": "Фокусный объект на уровне медианы.",
        "boundaryApplied": false,
        "comparisonState": "equal",
        "consumerCalculations": [],
        "cssState": "equal",
        "deviationRaw": 0.0,
        "displayDeviation": 0,
        "displayRelationText": "на уровне медианы",
        "displayUnit": "brands",
        "glyph": "●",
        "mode": "count"
      }
    },
    "xlsx": {
      "applicable": false,
      "consumerCalculations": [],
      "projection": null,
      "reason": "NO_DEDICATED_CATEGORY_BENCHMARK_EXPORT_SURFACE_ON_BASELINE"
    }
  },
  "fixtureId": "F172_C005_exact_zero",
  "implementationEvidenceAvailable": false,
  "kind": "positive",
  "mode": "count",
  "productionConformanceClaimed": false,
  "rawInput": {
    "focusCount": 10,
    "mode": "count",
    "peerCounts": [
      10
    ],
    "peerMedianCount": 10,
    "signedZeroSource": false,
    "sourceDeviationRaw": 0
  },
  "sourceIssue": "#172"
}
